app_name,rating,text
SnapMuse AI,5,操作が直感的で、数分で写真集ができる。自動レイアウトがちょうど良い。サブスク980円は妥当。
SnapMuse AI,4,顔の一貫性は時々崩れるが、SNS用には十分。エクスポートが速い。
SnapMuse AI,3,無料トライアルが分かりにくい。年間プランの割引は魅力。UXは改善余地あり。
SnapMuse AI,2,細かい配置調整ができない。ヘルプが薄い。返金対応は早かった。
SnapMuse AI,5,和文フォントも綺麗で、印刷クオリティも良い。家族アルバムに最適。
PixStory Pro,4,テンプレが豊富で楽。月額1200円は少し高めだが品質は良い。
PixStory Pro,5,顔認識が強い。一貫性が高くモデル撮影っぽく仕上がる。SNS映えする。
PixStory Pro,3,書き出しに時間がかかる。UIの反応が遅いときがある。
PixStory Pro,2,課金導線が強すぎて不快。お試しが短い。
PixStory Pro,4,コラージュ機能が便利。チュートリアルが丁寧で迷わない。
PhotoVerse,5,年額プランの割引が大きい。家族イベントまとめに重宝。
PhotoVerse,4,価格は手頃（780円）。フィルタも豊富で遊べる。
PhotoVerse,2,人物の手が崩れることが多い。サポート返答が遅かった。
PhotoVerse,3,使い方が最初難しい。慣れると早い。
PhotoVerse,4,SNSプリセットが良い。書き出しサイズの選択肢が多い。
